{
  "$schema": "https://json-schema.org/draft/2020-12/schema",
  "$id": "https://aeg.dev/schemas/situated-s1-manifest-v1.json",
  "type": "object",
  "additionalProperties": false,
  "required": ["schema_version", "benchmark_id", "name", "status", "family", "frozen_at", "protocol", "promotion_criteria", "stop_conditions", "pairs"],
  "properties": {
    "schema_version": {"const": "1.0.0"},
    "benchmark_id": {"const": "situated-experience-benchmark-v1"},
    "name": {"const": "Situated Experience Benchmark v1"},
    "status": {"const": "frozen-before-arm-execution"},
    "family": {"const": "S1"},
    "frozen_at": {"type": "string", "format": "date-time"},
    "protocol": {
      "type": "object",
      "additionalProperties": false,
      "required": ["replicates_per_arm", "modes", "randomization_seed", "model", "task_input_policy", "budget", "evaluation_thresholds", "measurement_contract", "arm_orders"],
      "properties": {
        "replicates_per_arm": {"const": 3},
        "modes": {"const": ["control", "aeg-assisted"]},
        "randomization_seed": {"type": "string"},
        "model": {"type": "string"},
        "task_input_policy": {"type": "string"},
        "budget": {"type": "object", "additionalProperties": false, "required": ["wall_time_seconds", "max_completed_commands", "max_attempts"], "properties": {"wall_time_seconds": {"type": "integer", "minimum": 1}, "max_completed_commands": {"type": "integer", "minimum": 1}, "max_attempts": {"type": "integer", "minimum": 1}}},
        "evaluation_thresholds": {"type": "object", "additionalProperties": false, "required": ["effort_change_fraction", "max_treatment_token_overhead_fraction", "minimum_interpretable_repair_path_improvements", "negative_transfer_effort_measure_count"], "properties": {"effort_change_fraction": {"const": 0.2}, "max_treatment_token_overhead_fraction": {"const": 0.3}, "minimum_interpretable_repair_path_improvements": {"const": 1}, "negative_transfer_effort_measure_count": {"const": 2}}},
        "measurement_contract": {"type": "string"},
        "arm_orders": {"type": "object", "additionalProperties": {"type": "array", "minItems": 3, "maxItems": 3, "items": {"type": "array", "minItems": 2, "maxItems": 2, "items": {"enum": ["control", "aeg-assisted"]}}}}
      }
    },
    "promotion_criteria": {"type": "array", "minItems": 5, "items": {"type": "string"}},
    "stop_conditions": {"type": "array", "minItems": 6, "items": {"type": "string"}},
    "pairs": {
      "type": "array",
      "minItems": 2,
      "maxItems": 2,
      "items": {
        "type": "object",
        "additionalProperties": false,
        "required": ["pair_id", "title", "project", "license", "fixture_kind", "source", "transfer", "experience_path", "experience_sha256", "source_fixture_sha256", "source_human_patch_sha256", "source_hidden_tests_sha256", "agent_fixture_sha256", "human_patch_sha256", "hidden_tests_sha256", "source_public_test_command", "public_test_command", "hidden_test_command", "source_initial_failure_pattern", "initial_failure_pattern", "historical_failure_paths", "environment_assumptions"],
        "properties": {
          "pair_id": {"type": "string"}, "title": {"type": "string"}, "project": {"type": "string"}, "license": {"type": "string"}, "fixture_kind": {"const": "dependency-free-public-extract"},
          "source": {"$ref": "#/$defs/public_task"}, "transfer": {"$ref": "#/$defs/public_task"},
          "experience_path": {"type": "string"}, "experience_sha256": {"$ref": "#/$defs/sha"}, "source_fixture_sha256": {"$ref": "#/$defs/sha"}, "source_human_patch_sha256": {"$ref": "#/$defs/sha"}, "source_hidden_tests_sha256": {"$ref": "#/$defs/sha"}, "agent_fixture_sha256": {"$ref": "#/$defs/sha"}, "human_patch_sha256": {"$ref": "#/$defs/sha"}, "hidden_tests_sha256": {"$ref": "#/$defs/sha"},
          "source_public_test_command": {"type": "string"}, "public_test_command": {"type": "string"}, "hidden_test_command": {"type": "string"}, "source_initial_failure_pattern": {"type": "string"}, "initial_failure_pattern": {"type": "string"},
          "historical_failure_paths": {"type": "array", "minItems": 1, "items": {"type": "object", "additionalProperties": false, "required": ["id", "description", "pattern"], "properties": {"id": {"type": "string"}, "description": {"type": "string"}, "pattern": {"type": "string"}}}},
          "environment_assumptions": {"type": "array", "minItems": 1, "items": {"type": "string"}}
        }
      }
    }
  },
  "$defs": {
    "sha": {"type": "string", "pattern": "^[0-9a-f]{64}$"},
    "public_task": {"type": "object", "additionalProperties": false, "required": ["bug_id", "buggy_commit", "fixed_commit", "fixed_at", "evidence_url"], "properties": {"bug_id": {"type": "string"}, "buggy_commit": {"type": "string", "pattern": "^[0-9a-f]{40}$"}, "fixed_commit": {"type": "string", "pattern": "^[0-9a-f]{40}$"}, "fixed_at": {"type": "string", "format": "date-time"}, "evidence_url": {"type": "string", "format": "uri"}}}
  }
}
